3 по цене 2! Мультивитаминный крем для рук и ногтей с минералами Мертвого моря 3 x 100ml;Уход за телом;Вы можете получить 3 тюбика мультивитаминного крема для рук и ногтей с минералами Мертвого моря по цене 2-ух!<br>100 мл каждый тюбик.<br>(артикул 14879);publish;no;instock;14879;1296,75;3-price-2-dead-sea-minerals-multi-vitamin-hand-nail-cream-3-x-100ml.jpg
AHAVA Deadsea, Минеральный крем для рук;Уход за телом;Питательный, содержащий минералы Метртвого Моря крем от  AHAVA.<br>Содрежит УФ - фильтры, гипоалергенный, не содержит парабенов, 100 мл;publish;no;instock;15268;714,35;ahava-deadsea-water-mineral-hand-cream.jpg
AHAVA Крем для рук - Набор из трех упаковок;Уход за телом;Набор из трех кремов;publish;no;instock;15270;2921,75;ahava-hand-cream-super-saver-3-pack.jpg
AHAVA Набор Крем для рук и Лосьон для тела, Dead Sea Cosmetics;Для жирной кожи;Косметика AHAVA известна своими запатентованными комплексами, которые в сочетании с растительными экстрактами увлажняют, восстанавливают и омолаживают кожу рук и тела. Подходит для всех типов кожи;publish;no;instock;16580;1816,75;ahava-value-set-hand-cream-and-body-lotion-dead-sea-cosmetics.jpg
AHAVA Набор Крем для рук и Лосьон для тела, Dead Sea Cosmetics;Крема;Косметика AHAVA известна своими запатентованными комплексами, которые в сочетании с растительными экстрактами увлажняют, восстанавливают и омолаживают кожу рук и тела. Подходит для всех типов кожи;publish;no;instock;16580;1816,75;ahava-value-set-hand-cream-and-body-lotion-dead-sea-cosmetics.jpg
AHAVA Набор Крем для сухой кожи рук и Крем для ног, Dead Sea Cosmetics;Для жирной кожи;DERMUD - это рациональный уход именно за сухой и чувствительной кожей.<br>Эффективно устраняет дефекты сухой кожи : шелушение, огрубение, покраснение, трещины). 100 ml;publish;no;instock;16581;1946,75;ahava-value-set-dermud-hand-cream-and-foot-cream-dead-sea-cosmetics.jpg
AHAVA Набор Крем для сухой кожи рук и Крем для ног, Dead Sea Cosmetics;Крема;DERMUD - это рациональный уход именно за сухой и чувствительной кожей.<br>Эффективно устраняет дефекты сухой кожи : шелушение, огрубение, покраснение, трещины). 100 ml;publish;no;instock;16581;1946,75;ahava-value-set-dermud-hand-cream-and-foot-cream-dead-sea-cosmetics.jpg
AHAVA Набор минеральный  Крем для рук и Крем для ног, Dead Sea Cosmetics;Для жирной кожи;Косметика AHAVA известна своими запатентованными комплексами, которые в сочетании с растительными экстрактами увлажняют, восстанавливают и омолаживают кожу рук и ног. Подходит для всех типов кожи 100 ml;publish;no;instock;16582;1946,75;ahava-value-set-mineral-hand-cream-and-foot-cream-dead-sea-cosmetics.jpg
AHAVA Набор минеральный  Крем для рук и Крем для ног, Dead Sea Cosmetics;Крема;Косметика AHAVA известна своими запатентованными комплексами, которые в сочетании с растительными экстрактами увлажняют, восстанавливают и омолаживают кожу рук и ног. Подходит для всех типов кожи 100 ml;publish;no;instock;16582;1946,75;ahava-value-set-mineral-hand-cream-and-foot-cream-dead-sea-cosmetics.jpg
Bio Spa Dead Sea Грязевая маска Sea of Spa;Для жирной кожи;Грязевая маска с минералами Мертвого Моря.  Обладает глубоким очищающим эффектом, выравнивает и увлажняет кожу.<br>Наносится не чаще 2 раз в неделю;publish;no;instock;15774;1556,75;bio-spa-dead-sea-mud-mask-sea-spa.jpg
Bio Spa Dead Sea Грязевая маска Sea of Spa;Крема;Грязевая маска с минералами Мертвого Моря.  Обладает глубоким очищающим эффектом, выравнивает и увлажняет кожу.<br>Наносится не чаще 2 раз в неделю;publish;no;instock;15774;1556,75;bio-spa-dead-sea-mud-mask-sea-spa.jpg
Bio Spa Dead Sea Грязевая маска Sea of Spa;Сыворотки и маски;Грязевая маска с минералами Мертвого Моря.  Обладает глубоким очищающим эффектом, выравнивает и увлажняет кожу.<br>Наносится не чаще 2 раз в неделю;publish;no;instock;15774;1556,75;bio-spa-dead-sea-mud-mask-sea-spa.jpg
Bio Spa Гель - сыворотка для волос с маслом Аргана и Минералами Мертвого Моря;Уход за волосами;Для ежедневного применения. Наносится на кончики пальцев, растирается и затем втирается в основание волос. Можно Нанести на кончики волос, если есть секущиеся или сухие концы.<br><br>Гель имеет в составе:<br> -  Омега 6 жирные кислоты, что оказывает питательный эффект,  <br>- витамин Е - восстановоит даже самые поврежденные и слабые волосы <br><br>100 мл<br>(артикул 15849);publish;no;instock;15849;1426,75;bio-spa-hair-serum-drops-argan-oil-and-dead-sea-minerals.gif
Bio Spa Профессиональный кондиционер для сухих и окрашенных волос;Уход за волосами;Содержит масло Аргана и Масло Ши.<br>Увлажняет и питает кожу головы, восстанавливает поврежденные волосы, питая луковицы.<br><br>Подходит для ежедневного использования<br><br>400 мл<br><br>(артикул 15834);publish;no;instock;15834;1101,75;bio-spa-professional-conditioner-dry-damaged-colored-hair-argan-oil-and-shea-butter.gif
Bio Spa Профессиональный увлажняющий крем для волос;Уход за волосами;Крем обогащен маслом Аргана и маслом Ши.<br>Не требует смывания, наносится на влажные волосы.<br>Крем питает и увлажняет волосы, делает их гладкими и послушными в укладке. В то же время, масла не отягощают волосы, поэтому этот продукт относится к профессиональному уходу - после укладки прическа держится долго и волосы выглядят ухоженно;publish;no;instock;15836;1101,75;bio-spa-professional-leave-hair-moisturizing-cream-enriched-argan-oil-and-shea-butter.gif
Bio Spa Профессиональный Шампунь для жирных и тонких волос;Уход за волосами;Bio Spa Профессиональный шампунь для жирных и тонких волос с грязью Мертвого Моря и Алоэ Вера<br>Грязь мертвого моря оказывает обезжиривающий и восстанавливающий эффект для волос, питая при этом кожу и нормализуя жировой баланс.<br><br>Алоэ Вера оказывает успокаивающий и восстановительный эффект<br><br>400 мл<br><br>(артикул 15835);publish;no;instock;15835;1101,75;bio-spa-professional-shampoo-oily-thin-hair-dead-sea-mud-and-aloe-vera.gif
Bio Spa Профессиональный Шампунь для жирных и тонких волос;Уход за телом;Bio Spa Профессиональный шампунь для жирных и тонких волос с грязью Мертвого Моря и Алоэ Вера<br>Грязь мертвого моря оказывает обезжиривающий и восстанавливающий эффект для волос, питая при этом кожу и нормализуя жировой баланс.<br><br>Алоэ Вера оказывает успокаивающий и восстановительный эффект<br><br>400 мл<br><br>(артикул 15835);publish;no;instock;15835;1101,75;bio-spa-professional-shampoo-oily-thin-hair-dead-sea-mud-and-aloe-vera.gif
Bio Spa Профессиональный шампунь для поврежденных и сухих волос;Уход за волосами;Содержит минералы Мертвого Моря, масло Аргана и экстракт ростков пшеницы. <br>Масло Арганы увлажняет и питает кожу головы, экстракт ростков пшеницы восстанавливает головы и стимулирует рост волос.<br><br>Минералы Мертвого Моря способствуют восстановлению баланса жирности и стимулируют регенерацию как кожи головы, так и волос<br><br>400 мл<br><br>(артикул 15833);publish;no;instock;15833;1101,75;bio-spa-professional-shampoo-damaged-dry-colored-hair-argan-wheat-sprout.gif
Bio Spa Профессиональный шампунь для поврежденных и сухих волос;Уход за телом;Содержит минералы Мертвого Моря, масло Аргана и экстракт ростков пшеницы. <br>Масло Арганы увлажняет и питает кожу головы, экстракт ростков пшеницы восстанавливает головы и стимулирует рост волос.<br><br>Минералы Мертвого Моря способствуют восстановлению баланса жирности и стимулируют регенерацию как кожи головы, так и волос<br><br>400 мл<br><br>(артикул 15833);publish;no;instock;15833;1101,75;bio-spa-professional-shampoo-damaged-dry-colored-hair-argan-wheat-sprout.gif
Bio Spa Профессиональный шампунь для сухих окрашенных волос;Уход за волосами;Bio Spa Профессиональный шампунь для сухих окрашенных волос с маслом Аргана и  Экстрактом ростков пшеницы<br><br>Обогащен минералами Мертвого Моря,  питающими и нормализующими обмен веществ кожи головы, <br><br>масло Аргана - питает и увлажняет волосы, <br><br>ростки пшеницы оказывают мощный регенерирующий эффект, стимулируя рост волос.<br><br>400 мл<br><br>(артикул 15833);publish;no;instock;15833;1101,75;bio-spa-professional-shampoo-damaged-dry-colored-hair-argan-wheat-sprout.gif
Bio Spa Профессиональный шампунь для сухих окрашенных волос;Уход за телом;Bio Spa Профессиональный шампунь для сухих окрашенных волос с маслом Аргана и  Экстрактом ростков пшеницы<br><br>Обогащен минералами Мертвого Моря,  питающими и нормализующими обмен веществ кожи головы, <br><br>масло Аргана - питает и увлажняет волосы, <br><br>ростки пшеницы оказывают мощный регенерирующий эффект, стимулируя рост волос.<br><br>400 мл<br><br>(артикул 15833);publish;no;instock;15833;1101,75;bio-spa-professional-shampoo-damaged-dry-colored-hair-argan-wheat-sprout.gif
Bio Spa Профессиональный шампунь для укрепления волос ;Уход за волосами;Sea of Spa' Шампунь для укрепления волос с экстрактом моркови и маслом Ши<br><br>Предназначен для окрашенных волос<br>Во-первых, закрепляет нанесенный цвет, <br>во-вторых, восстанавливает волосы.<br>Содержит:<br> - экстракт моркови<br>- витамины A, C, E и B5 - минералы Мертвого Моря. <br><br>Шампунь укрепляет корни волос и питает кожу головы<br><br>Подходит для ежедневного использования<br> <br>400 мл<br><br> (артикул 15832);publish;no;instock;15832;1101,75;bio-spa-professional-shampoo-stronger-hair-enriched-carrot-sea-buckthorn.gif
Bio Spa Профессиональный шампунь для укрепления волос ;Уход за телом;Sea of Spa' Шампунь для укрепления волос с экстрактом моркови и маслом Ши<br><br>Предназначен для окрашенных волос<br>Во-первых, закрепляет нанесенный цвет, <br>во-вторых, восстанавливает волосы.<br>Содержит:<br> - экстракт моркови<br>- витамины A, C, E и B5 - минералы Мертвого Моря. <br><br>Шампунь укрепляет корни волос и питает кожу головы<br><br>Подходит для ежедневного использования<br> <br>400 мл<br><br> (артикул 15832);publish;no;instock;15832;1101,75;bio-spa-professional-shampoo-stronger-hair-enriched-carrot-sea-buckthorn.gif
Bio Spa Сыворотка для волос с маслом Аргана и минералами Мертвого Моря;Уход за волосами;BIO SPA – Сыворотка для волос, обогащенная маслом Аргана.  <br>Продукт относится к серии ежедневного ухода за волосами. <br>Несколько капель сыворотки наносятся на влажные волосы, это дает защиту волосам, питание, уход, легкость в укладке и гладкость волос. <br>Масло Арганы питает волосы омега 6 - жирной кислотой и витамином Е.<br><br>Сыворотка идеально подходит для волос, поврежденных окраской, завивкой и термообработкой <br><br>100 мл<br>(артикул 15849);publish;no;instock;15849;1426,75;bio-spa-hair-serum-drops-argan-oil-and-dead-sea-minerals.gif
Canaan Organic Восстанавливающий крем для тела;Уход за телом;Крем питает кожу, давай клеткам энергию, омолаживая кожу.;publish;no;instock;16393;1296,75;canaan-organic-revitalizing-body-cream-organic-skin-care.gif
Canaan Восстанавливающий шампунь, Organic Skin Care;Уход за волосами;Содержит масло ореховn Macadamia, масло Жожоба и Оливковое масло. <br>Все экстракты исключительно органического происхождения, содержит ароматические масла.<br> <br> <br>Запатентованный комплекс веществ CSE Complex™ оказывает восстанавливающее и омолаживающее действие<br> <br>Шампунь позиционируется как гипоаллергенная косметика для волос<br><br>250 мл<br>(артикул 16384);publish;no;instock;16384;1101,75;canaan-restorative-organic-shampoo-organic-skin-care.gif
Canaan Восстанавливающий шампунь, Organic Skin Care;Уход за телом;Содержит масло ореховn Macadamia, масло Жожоба и Оливковое масло. <br>Все экстракты исключительно органического происхождения, содержит ароматические масла.<br> <br> <br>Запатентованный комплекс веществ CSE Complex™ оказывает восстанавливающее и омолаживающее действие<br> <br>Шампунь позиционируется как гипоаллергенная косметика для волос<br><br>250 мл<br>(артикул 16384);publish;no;instock;16384;1101,75;canaan-restorative-organic-shampoo-organic-skin-care.gif
Canaan крем для рук, Dead Sea Cosmetics;Уход за телом;Canaan Крем для рук считается лучшим в этой серии.<br>Содержит минералы Мертвого Моря и интенсивную увлажняющую и восстанавливающую кремовую основу.<br>Подходит для любого типа кожи;publish;no;instock;16410;776,75;canaan-hand-cream-dead-sea-cosmetics.gif
Canaan Крем-пилинг для ног, Dead Sea Cosmetics;Уход за телом;Очищает кожу, мягко растворяя огрубевшую кожу ног. Содержит кислоты исключительно растительного происхождения;publish;no;instock;16422;841,75;canaan-peeling-foot-cream-dead-sea-cosmetics.gif
Canaan Лосьон для тела на водной основе, Dead Sea Cosmetics;Уход за телом;Смягчает и увлажняет. Это лосьон на водной основе, поэтому он подходит для жирной или комбинированной кожи, раскрывает поры и в то же время удерживает влагу внутри.;publish;no;instock;16446;1296,75;canaan-aqua-based-body-lotion-dead-sea-cosmetics.gif
Canaan Масло - кондиционер для тела, Organic Cosmetics;Уход за телом;Питательное, увлажняющее масло - кондиционер, используется ПОСЛЕ ванной или душа или при массаже.;publish;no;instock;16385;1296,75;canaan-conditioning-body-oil-organic-cosmetics.gif
Canaan Массажное масло для тела, Dead Sea Cosmetics;Уход за телом;Очищают кожу, оказывает легкий разогревающий эффект, содержит растительные масла;publish;no;instock;16448;1036,75;canaan-rich-massage-body-oil-dead-sea-cosmetics.gif
Canaan многофункциональный крем для рук, Organic Cosmetics;Уход за телом;Комплексный уход за чувствительной кожей рук. Органические  масла орехов макадамии, жожоба и оливок.<br>Смягчает кожу рук, снимает раздражение, делает кожу гладкой  и эластичной;publish;no;instock;16389;906,75;canaan-multi-action-hand-cream-organic-cosmetics.gif
Canaan Мыло - плинг для тела, Dead Sea;Для жирной кожи;За счет наличия мягких органических кислот в составе мыло прекрасно удаляет огрубевшие частички кожи, минералы Мертвого Моря балансируют pH кожи, делая ее мягкой и гладкой.<br><br>250 мл<br>(артикул 16440);publish;no;instock;16440;1101,75;canaan-body-peeling-soap-dead-sea-products.gif
Canaan Мыло - плинг для тела, Dead Sea;Крема;За счет наличия мягких органических кислот в составе мыло прекрасно удаляет огрубевшие частички кожи, минералы Мертвого Моря балансируют pH кожи, делая ее мягкой и гладкой.<br><br>250 мл<br>(артикул 16440);publish;no;instock;16440;1101,75;canaan-body-peeling-soap-dead-sea-products.gif
Canaan Мыло с минеральной грязью Мертвого МОря, Dead Sea ;Сыворотки и маски;Уникальное мыло из серии Dead Sea, содержит 21 минеральных компонента Мертвого Моря  и масла. <br>Используется как мыло - скраб, поддерживающий оптимальный pH кожи .<br><br> Содержит запатентованный комплекс CSE Complex ™ и оливковое масло, т.о. мыло оказывает и очищающий, и увлажняющий эффект.<br><br>Не сушит кожу, имеет гипоаллергенный эффект.<br><br>100 г<br><br>(артикул 16427);publish;no;instock;16427;516,75;canaan-mineral-mud-soap-dead-sea-cosmetics.gif
Canaan Мыло с минеральной грязью Мертвого МОря, Dead Sea ;Уход за телом;Уникальное мыло из серии Dead Sea, содержит 21 минеральных компонента Мертвого Моря  и масла. <br>Используется как мыло - скраб, поддерживающий оптимальный pH кожи .<br><br> Содержит запатентованный комплекс CSE Complex ™ и оливковое масло, т.о. мыло оказывает и очищающий, и увлажняющий эффект.<br><br>Не сушит кожу, имеет гипоаллергенный эффект.<br><br>100 г<br><br>(артикул 16427);publish;no;instock;16427;516,75;canaan-mineral-mud-soap-dead-sea-cosmetics.gif
Dead Sea гипоалергенное Мыло с Оливковым маслом и Медом;Для жирной кожи;Dead Sea антивозрастное минеральное мыло.<br>Содержит Оливковое масло и мед, отлично увлажняя и очищая кожу<br><br>125 г <br>(артикул 13174);publish;no;instock;13174;776,75;hypoallergenic-olive-oil-honey-dead-sea-soap.jpg
Dead Sea гипоалергенное Мыло с Оливковым маслом и Медом;Крема;Dead Sea антивозрастное минеральное мыло.<br>Содержит Оливковое масло и мед, отлично увлажняя и очищая кожу<br><br>125 г <br>(артикул 13174);publish;no;instock;13174;776,75;hypoallergenic-olive-oil-honey-dead-sea-soap.jpg
Dead Sea гипоалергенное Мыло с Оливковым маслом и Медом;Лечебная косметика;Dead Sea антивозрастное минеральное мыло.<br>Содержит Оливковое масло и мед, отлично увлажняя и очищая кожу<br><br>125 г <br>(артикул 13174);publish;no;instock;13174;776,75;hypoallergenic-olive-oil-honey-dead-sea-soap.jpg
Dead Sea гипоалергенное Мыло с Оливковым маслом и Медом;Уход за телом;Dead Sea антивозрастное минеральное мыло.<br>Содержит Оливковое масло и мед, отлично увлажняя и очищая кожу<br><br>125 г <br>(артикул 13174);publish;no;instock;13174;776,75;hypoallergenic-olive-oil-honey-dead-sea-soap.jpg
Dead Sea Защитный крем для рук, Natural Sea Beauty;Уход за телом;Защищает кожу рук от УФ - воздействия и смягчает;publish;no;instock;7116;1491,75;dead-sea-protective-hand-cream-natural-sea-beauty.jpg
